{
  "schema_version": 1,
  "manifest_id": "showdown-oracle-source-6a1836dd",
  "repository_url": "https://github.com/smogon/pokemon-showdown",
  "commit": "6a1836dd71c0718e923206f3d089e61074410868",
  "package_name": "pokemon-showdown",
  "package_version": "0.11.11",
  "declared_node_version": ">=16.0.0",
  "license_path": "LICENSE",
  "license_digest": "sha256:b2002a9fd52ba8db3783a05fbdebfb09c34fd09513b90f6b390a2c0dfbc93ed0",
  "package_lock_path": "package-lock.json",
  "lockfile_version": 2,
  "package_lock_digest": "sha256:f207748a1ef4e549160defbbb688de0f35889f3038939edebb5a956cf41b9d0a",
  "package_json_path": "package.json",
  "package_json_digest": "sha256:561152e07c4a0f4a8ddb0ab60bc3f4c3225bac24b207a70545f528d5bc4727e9",
  "source_scope": "full_git_tree",
  "source_files": [
    {
      "path": ".editorconfig",
      "digest": "sha256:94d18c70e4d84a6e526055f2ed62f8ebe04c81b4c74ff69aa2ef43698fe5ceae",
      "size": 464
    },
    {
      "path": ".gitattributes",
      "digest": "sha256:e753774a5c6c845d5b43db5e4e133c8b7308c233f036517be1e2ae01cb068790",
      "size": 12
    },
    {
      "path": ".github/workflows/publish.yml",
      "digest": "sha256:2b9af8a4a33bdfd8fa252b324b239b088ec33e418c2f79a6c6b71998aea7a82e",
      "size": 1540
    },
    {
      "path": ".github/workflows/test.yml",
      "digest": "sha256:4bdd3d147275ee1b2eb83dbfe3c90d83f38cacd98b03e79522bf44a818f14db6",
      "size": 2926
    },
    {
      "path": ".github/workflows/update_version.yml",
      "digest": "sha256:41304507ebde28442b124dcda9019fb593d136d0160a024bbc4dae6857993d82",
      "size": 1315
    },
    {
      "path": ".gitignore",
      "digest": "sha256:435829de010394ff6cd6dcc7d9930022b73ff67446d7bb97fecb7c464e02bd44",
      "size": 843
    },
    {
      "path": ".mocharc.json",
      "digest": "sha256:44626758d825595e8a687bf322e116371cf75bf15ada7c654e63f8c8136197d8",
      "size": 233
    },
    {
      "path": ".npmignore",
      "digest": "sha256:706be2a8bf5eb7d4863865efbfb062e2f7875490b76c1ccc8f9ed2ecdfde3d9c",
      "size": 659
    },
    {
      "path": ".npmrc",
      "digest": "sha256:2cbb6fedd756e15cffb401288df8cae226a5cfad706eefa735a1e8c830389633",
      "size": 39
    },
    {
      "path": ".vscode/launch.json",
      "digest": "sha256:9fefee233a969fb525311693d23aaa9aa31f2b699e0aae4d6b0c43f28cef6e51",
      "size": 1050
    },
    {
      "path": ".vscode/settings.json",
      "digest": "sha256:eb8ed9c6c243d2dec1b8b1f2fef9605dd30363bb82db971ed59c145c33ea113a",
      "size": 215
    },
    {
      "path": "ARCHITECTURE.md",
      "digest": "sha256:b193529883b1880f8586b7333ce1327bfb418136cf23fd5aa4d0d214c54d34ca",
      "size": 3313
    },
    {
      "path": "CODEOWNERS",
      "digest": "sha256:51e2ae5ae9831026379d987820aab3520c5e60b6fbeb7a0882a7396cd8d31e99",
      "size": 1441
    },
    {
      "path": "COMMANDLINE.md",
      "digest": "sha256:a35d93f671dd977845513c4b70fd75cd1e05f7279910f706d748032eca68e13d",
      "size": 3733
    },
    {
      "path": "CONTRIBUTING.md",
      "digest": "sha256:d276423019a967983ce97b7bf9152436d6e3866146a719228cf7098bf594af07",
      "size": 18971
    },
    {
      "path": "LICENSE",
      "digest": "sha256:b2002a9fd52ba8db3783a05fbdebfb09c34fd09513b90f6b390a2c0dfbc93ed0",
      "size": 1136
    },
    {
      "path": "PROTOCOL.md",
      "digest": "sha256:399a301c48de30dabd849d5447c8a10cddca96feabbd3c1b4444239c20321dbd",
      "size": 16810
    },
    {
      "path": "Procfile",
      "digest": "sha256:062050afb2bc5d7c8911cd8d66a2373ce2441cae00104c077d23a445d3ee6c39",
      "size": 32
    },
    {
      "path": "README.md",
      "digest": "sha256:062e07dc0d5e0322e925f4bfc7d78905fc9b8ff3eeb92496b46f5aae44683038",
      "size": 3609
    },
    {
      "path": "build",
      "digest": "sha256:9172c1b59203f31d5565ecd4aafbd2962741c5dc99cd3ac487d42e0e4fa854d0",
      "size": 1594
    },
    {
      "path": "config/CUSTOM-RULES.md",
      "digest": "sha256:1ad34dd1f3478f0d3cddb6d499a517aca8f9fe593aac4b4f199ff553eddaeb0a",
      "size": 16417
    },
    {
      "path": "config/avatars/README.md",
      "digest": "sha256:fd39943df2beb229e6842a4cfdba4fe35c4aac824846abd8f1277c86edcca2d9",
      "size": 173
    },
    {
      "path": "config/chat-plugins/README.md",
      "digest": "sha256:709b044394df3a609d1838dac50e214706f42e0996988d802c291ccbed37a8b8",
      "size": 55
    },
    {
      "path": "config/config-example.js",
      "digest": "sha256:05fb15ac3bf2bed1a45ba6cc30183efc37fbb5896bbb58329bcf457cbf9611e9",
      "size": 24435
    },
    {
      "path": "config/custom-example.css",
      "digest": "sha256:734780d0fe76312bfcc07ecc790c26c38784c3a5b1ad9fa08dbf35ae2513c0a2",
      "size": 351
    },
    {
      "path": "config/formats.ts",
      "digest": "sha256:953d845b93ee6533651098692b764cfe1f2b2c6068ae24a08e0ce81af40b9af2",
      "size": 265970
    },
    {
      "path": "config/hosts.csv",
      "digest": "sha256:0a876e00bc20ff39afad7742589806020f34bb2580022e96b8e1ceac28bf1759",
      "size": 4878
    },
    {
      "path": "config/ladders/README.md",
      "digest": "sha256:dbb39feb5c86238ab1cc2efee3390b88a68da47958d3ea4d2fad1a50ea037210",
      "size": 203
    },
    {
      "path": "config/proxies.csv",
      "digest": "sha256:945f657a06f70571132dd3f0b6683a8b13b6ea267f17ca878e889081e245ce21",
      "size": 250276
    },
    {
      "path": "data/FORMES.md",
      "digest": "sha256:92425e1cd24734208f3a6cdeb697ee87cc62eb1cd4479caa93df160c968923d2",
      "size": 8208
    },
    {
      "path": "data/abilities.ts",
      "digest": "sha256:175067b1e827ca11ae4728169215c9bdd27ac4cb3e35d2e83eaaaee7e9e8c842",
      "size": 156616
    },
    {
      "path": "data/aliases.ts",
      "digest": "sha256:70c3b336c8859823adfcc6879bc433566783cf91cfdf49f8447950298dcbae7a",
      "size": 72254
    },
    {
      "path": "data/conditions.ts",
      "digest": "sha256:03ec1b90913f864a0baab0574a70abb856d5e84f722acf96ab11a7601a72fc35",
      "size": 28860
    },
    {
      "path": "data/formats-data.ts",
      "digest": "sha256:d5434f5cf2242b829ce26c6a403ecf21dc1408b80a5a948a73586ee0872c9b2b",
      "size": 93261
    },
    {
      "path": "data/items.ts",
      "digest": "sha256:fd7a7b798ac872e53f7ee41806b3ec5692fa5bebcd720b544dd45bbed79a0a14",
      "size": 163613
    },
    {
      "path": "data/learnsets.ts",
      "digest": "sha256:a528380689497c018af77730aa9a13da0c1d8499e269e1a8db3f67f363d2875f",
      "size": 3722917
    },
    {
      "path": "data/mods/afd/abilities.ts",
      "digest": "sha256:917837a377fd1f9ee628cebc9f4d75ac9380d94cb342d5efbbc866b55e2535e2",
      "size": 6076
    },
    {
      "path": "data/mods/afd/conditions.ts",
      "digest": "sha256:138a58dc3628abbb48261b941259ed57cd4707922903173f1b3d2faf9cb74770",
      "size": 725
    },
    {
      "path": "data/mods/afd/items.ts",
      "digest": "sha256:2379473022c5be74189938a2f5c6301f9d524b52f7ba7827d34e42942d5df2c5",
      "size": 2374
    },
    {
      "path": "data/mods/afd/moves.ts",
      "digest": "sha256:b0ad04423f7e4ccd9b74053531033662487a9efa979c100f06aefdae6acc4fa8",
      "size": 15692
    },
    {
      "path": "data/mods/afd/pokedex.ts",
      "digest": "sha256:58dc9ddb3436f318e3618a4f868bfc46f7a496fd3d41eedcecc0c6e3a1ae8a9d",
      "size": 7256
    },
    {
      "path": "data/mods/afd/random-teams.ts",
      "digest": "sha256:6c8130e71a1a7fd46111a53ef00f1f4aeeaeff05a7fe6df2186254a1a58f0e9b",
      "size": 30092
    },
    {
      "path": "data/mods/afd/scripts.ts",
      "digest": "sha256:4c19f14e89d9bfa02a2b2daf5eddae0a29e4626af8d9ce0141818cefd17f82db",
      "size": 17739
    },
    {
      "path": "data/mods/afd/sets.json",
      "digest": "sha256:a17534a4fdf9e0c52d052f4da776deab6085e6e34d64d0f792419e30124dbf5f",
      "size": 32150
    },
    {
      "path": "data/mods/afd/typechart.ts",
      "digest": "sha256:5d6e2ed11e0368688333dd2883e91b35d918be32a925b30abd4f766379e8e4bc",
      "size": 682
    },
    {
      "path": "data/mods/biomechmons/abilities.ts",
      "digest": "sha256:926cd3ed283ad760d435dbf782bc639543c76ca1391f29297b4b8eaf943159d8",
      "size": 8789
    },
    {
      "path": "data/mods/biomechmons/conditions.ts",
      "digest": "sha256:1cd3f3bf654fcd4b24fac0124d63a0c4b1e6b1a2dbd31ddd4131e5b6c42fd972",
      "size": 1441
    },
    {
      "path": "data/mods/biomechmons/items.ts",
      "digest": "sha256:ea8c7ed182859bc6d2d88c70453b059c4defc7e73458d9397f612e8db295ab5e",
      "size": 1677
    },
    {
      "path": "data/mods/biomechmons/moves.ts",
      "digest": "sha256:c8a6907866665153e82f0716ea4162cf6acc284b515aef799e316563b16e11ad",
      "size": 16698
    },
    {
      "path": "data/mods/biomechmons/scripts.ts",
      "digest": "sha256:3f8ff7072d6b36f872814530d3d35c5662a2cdd87b972a05afc4fc6b4c80aef9",
      "size": 24444
    },
    {
      "path": "data/mods/ccapm2025/abilities.ts",
      "digest": "sha256:fdfd6fa46d512872b4474fa2537c0245f39ffdbbf03e6512e67a2282528e3dec",
      "size": 45924
    },
    {
      "path": "data/mods/ccapm2025/conditions.ts",
      "digest": "sha256:8cebb45bfd2aeb7c8e2b1c7cd40befc7a1f451d2076e81c3ccbb2b3c5d0e9a3e",
      "size": 6328
    },
    {
      "path": "data/mods/ccapm2025/formats-data.ts",
      "digest": "sha256:831c575692b949511d1d74800ef34506381e66b841efc6d6af96be7d0b12e178",
      "size": 9995
    },
    {
      "path": "data/mods/ccapm2025/items.ts",
      "digest": "sha256:4cf5d6d6ea5df6d20cd7edfb9cbca9c27068ee1a5e90e1b330ec2ba7fecbb40c",
      "size": 20849
    },
    {
      "path": "data/mods/ccapm2025/learnsets.ts",
      "digest": "sha256:48d59537abf3fa34c14b63e46df25eeaabbdf6ac0f5daa53c0b2095601413461",
      "size": 71067
    },
    {
      "path": "data/mods/ccapm2025/moves.ts",
      "digest": "sha256:648518fc7c01df408374f58bce09b725f91bc9663be6272999f06d19e002ddfe",
      "size": 80170
    },
    {
      "path": "data/mods/ccapm2025/pokedex.ts",